Traveller category,19-Nov,19-Dec,20-Jan,20-Feb,20-Mar,20-Apr,20-May,20-Jun,20-Jul,20-Aug,20-Sep
Total non resident travellers,1371282,1417963,1393487,1379182,605734,54569,42326,45499,43813,53263,71215
United States travellers,1100438,1141759,1117653,1123393,487804,41072,36236,39176,35295,40888,55955
Travellers from countries other than United States,270844,276204,275834,255790,117929,13497,6090,6323,8518,12375,15260
Total Canadian travellers returning from abroad,2316500,2372424,2348636,2367382,1403526,104405,125576,183927,177600,179541,217611
Canadian travellers returning from United States,1798413,1845441,1827057,1848164,1046049,83736,110783,162387,149827,144963,182469
Canadian travellers returning from countries other than United States,518088,526984,521579,519219,357477,20669,14792,21540,27773,34578,35142
